"ap_number","ap_title","ap_text","success","partners","progress","achieved","hic_number","hic_label","hic_class","timeframe","level","Clarity required","timeframe_short","timeframe_medium","timeframe_long","ongoing","timeframe_js","level_individual","level_community","level_place","level_js"
47,"Rollout Make Every Contact Count to clinical and non-clinical staff","Rollout Make Every Contact Count (MECC) programme to clinical and non-clinical staff in healthcare settings such as primary care","Increased confidence of front line staff in raising the issue of smoking","Public Health, Primary Care","Capacity issue raised by WSPH, Level 1 and Level 2 workshop available .","Green",6,"Build and sustain capacity in tobacco control","build_sustain_capacity","M","I",,,"mediumterm",,,"mediumterm  ","individual",,,"individual  "
48,"Signpost smokers to stop smoking services","Signpost smokers to stop smoking services when conducting Safe and Well visits","Increase in the number of people accessing the SSS","Fire Service","Where appropriate specialist home visiting staff are already doing this. Our curent IT system has nowhere to record this information so we have limited records. The system will be replaced at the end of this year. Crews will be better placed to signpost when they start using the new Safe and Well booklet.","Amber",6,"Build and sustain capacity in tobacco control","build_sustain_capacity","S","I",,"shortterm",,,,"shortterm   ","individual",,,"individual  "
49,"Health4Families staff training","Health4Families staff to complete National Centre for Smoking Cessation and Training Very Brief Advice level 1 training.","1. All staff will be VBA trained,            2. Staff will be confident to discuss smoking cessation and record conversation outcome","Health4Families","Progress unknown","Progress unknown",6,"Build and sustain capacity in tobacco control","build_sustain_capacity","S","I","Q. you mentioned that staff are audited every 6 months what does this mean and what is in the audit","shortterm",,,,"shortterm   ","individual",,,"individual  "
50,"Wellbeing hub staff level 1 training","Wellbeing hub staff to complete National Centre for Smoking Cessation and Training Very Brief Advice level 1 trianing.","1. All wellbeing staff will be VBA trained,            2. Wellbeing staff will be confident to discuss smoking cessation and record conversation outcome","Wellbeing programme","All hubs have level 1","Green",6,"Build and sustain capacity in tobacco control","build_sustain_capacity","S","I",,"shortterm",,,,"shortterm   ","individual",,,"individual  "
51,"Wellbeing hub staff level 2 training","Wellbeing hub staff to complete National Centre for Smoking Cessation and Training Very Brief Advice level 2 trianing.","1. All wellbeing staff will be VBA trained,            2. Wellbeing staff will be confident to discuss smoking cessation and record conversation outcome","Wellbeing programme","All hubs have level 2 trained advisors.  Service  delivery to start in Late Summer 20019","Amber",6,"Build and sustain capacity in tobacco control","build_sustain_capacity","S","I",,"shortterm",,,,"shortterm   ","individual",,,"individual  "
52,"Midwives level 1 training","Midwives to complete National Centre for Smoking Cessation and Training Very Brief Advice on smoking for pregnant women level 1 to talk about smoking cessation with pregnant women and their partners","1. All midwives will be VBA trained,            2. Midwives will be confident to discuss smoking cessation and record conversation outcome","Maternity at Western Hospitals","Progress unknown","Progress unknown",6,"Build and sustain capacity in tobacco control","build_sustain_capacity","S","I",,"shortterm",,,,"shortterm   ","individual",,,"individual  "
53,"Safe and Well visits to test individual levels of carbon monoxide","Use carbon monoxide (CO) Monitors during Safe and Well Visits to test individual levels of CO","Identify people who have high levels of CO in their breath and to raise awareness of the impact from smoking","Fire Service","This has not yet started it forms part of year three of the three year plan.","Amber",6,"Build and sustain capacity in tobacco control","build_sustain_capacity","L","I",,,,"longterm",,"longterm ","individual",,,"individual  "
54,"Disrupt the supply of illicit tobacco","Continue to disrupt the supply of illicit tobacco in West Sussex","More traders brought into  compliance, increase in numbes of seizures and quantities seized","Trading Standards","80% intel targets actioned (last year 75%). Less seizures and quantities seized so far.","Amber",7,"Tackle cheap and illicit tobacco","tackle_cheap_illicit_tob","S/M/L","C/P","Q. Can any of these be broken down into short medium or long term or are they all S/M/L term?","shortterm","mediumterm","longterm","ongoing","shortterm mediumterm longterm ongoing",,"community","place","community place"
55,"Educate consumers of illicit tobacco","Educate consumers of issues with illicit tobacco and how to report it","Increase in intelligence and intel reported","Trading Standards","No progress","Amber",7,"Tackle cheap and illicit tobacco","tackle_cheap_illicit_tob","S/M/L","C/P","Q. Can any of these be broken down into short medium or long term or are they all S/M/L term?","shortterm","mediumterm","longterm","ongoing","shortterm mediumterm longterm ongoing",,"community","place","community place"
56,"Clear reporting mechanisms for illicit tobacco among midwives","If staff are aware that illicit tobacco is being used they know how to report","Increase in the number of IT reports to Trading Standards","Maternity at Western Hospitals, Wellbeing programme","Progress unknown","Progress unknown",7,"Tackle cheap and illicit tobacco","tackle_cheap_illicit_tob","S","C",,"shortterm",,,,"shortterm   ",,"community",,"community "
57,"Review Smoke Free West Sussex Partnership membership","Review Smoke Free West Sussex Partnership membership","A partnership that actively discusses and addresses through working together the tobacco issues in West Sussex","Public Health","On workplan for October 2019","Progress unknown",8,"Influence change through advocacy","advocacy","S","P",,"shortterm",,,,"shortterm   ",,,"place","place"
58,"CLeaR deep dive","Complete a CLeaR model (Challenge, Leadership and Results) deep dive for Smokefree West Sussex","Recommendations to develop SFWSP","Public Health","This is due to start in 2020","Progress unknown",8,"Influence change through advocacy","advocacy","M","P",,,"mediumterm",,,"mediumterm  ",,,"place","place"
59,"Link messages into community and voluntary sector organsiations","Link messages regarding tobacco control into community and voluntary sector organsiations","Communities team raise tobacco control at a minimum of two events per year","Communities","Upcoming event in Wick (Littlehampton) for the community. Cream tea with info stands. Will disseminate cessation services and Illicit tobacco reporting info.","Green",8,"Influence change through advocacy","advocacy","S","C",,"shortterm",,,,"shortterm   ",,"community",,"community "
60,"Link tobacco control messages into directorate team meetings","Link messages regarding tobacco control into directorate team meetings","Tobacco control raised at a mnimum of two  C&PP directorate management team meetings a year","Communities","Directorate team meeting due next week has just been postponed until September","Amber",8,"Influence change through advocacy","advocacy","S","C",,"shortterm",,,,"shortterm   ",,"community",,"community "
61,"Raise the issue of tobacco control in West Sussex","Support members and the Director of Public Health in West Sussex to raise the issue of tobacco control","Whole system approaches to tobacco control embedded  and health in all policies include tobacco control","Public Health, District & Boroughs","TC strategy signed off by HWbB, presented at LCN, CIP,  CWS cancer steering group","Amber",8,"Influence change through advocacy","advocacy","L","P",,,,"longterm",,"longterm ",,,"place","place"
62,"Under age sales operations on intel led targets","Continue to undertake under age sales operations on intel led targets","Reduction in 'hit rates' of sales in UAS operations","Trading Standards","0 from 1 visit so 0%","Green",9,"Helping young people to be tobacco free","yp_smokefree","S/M/L","I/C/P","Q. Can any of these be broken down into short medium or long term or are they all S/M/L term?","shortterm","mediumterm","longterm","ongoing","shortterm mediumterm longterm ongoing","individual","community","place","individual community place"
63,"Educating businesses in under age sales legislation","Educate businesses in West Sussex in under age sales legislation","Increased number of businesses with knowledge of UAS legislation and engagment with TS","Trading Standards","Ongoing","Green",9,"Helping young people to be tobacco free","yp_smokefree","S/M/L","I/C/P","Q. Can any of these be broken down into short medium or long term or are they all S/M/L term?","shortterm","mediumterm","longterm","ongoing","shortterm mediumterm longterm ongoing","individual","community","place","individual community place"
64,"Understanding attitudes to smoking among young people in West Sussex","Increase local understanding of attitudes to smoking of young people in West Sussex","Approriate interventions developed based on insight","Public Health","Questionniare completed by students at Chichester college","Amber",9,"Helping young people to be tobacco free","yp_smokefree","M","C",,,"mediumterm",,,"mediumterm  ",,"community",,"community "
65,"Signpost Health4Families service users to stop smoking services","Referring young people who use Health4Families who are smokers to stop smoking services","Increase number of young people engaging with stop smoking services","Health4Families","Progress unknown","Progress unknown",9,"Helping young people to be tobacco free","yp_smokefree","S","I",,"shortterm",,,,"shortterm   ","individual",,,"individual  "
66,"Support the Local Maternity System","Support the Local Maternity System to achieve its aspirations related to tobacco control","LMS has achieved its aspirations","Public Health","Business case for maternity advisor being considered by LMS","Amber",9,"Helping young people to be tobacco free","yp_smokefree","M","I",,,"mediumterm",,,"mediumterm  ","individual",,,"individual  "
67,"Young parents care pathway","Use young parents care pathway as an opportunity to advise on health messages","Fewer young parents smoking at time of delivery","Maternity at Western Hospitals","Progress unknown","Progress unknown",9,"Helping young people to be tobacco free","yp_smokefree","S","I",,"shortterm",,,,"shortterm   ","individual",,,"individual  "
68,"Investigate efficacy of interventions for young people","Investigate efficacy of prevention and smoking cessation interventions for young people","Awareness of appropriate interventions for preventing the uptake of smoking among young people as well as helping them stop. This will be through a review of published and grey literature and other social research methods.","Public Health","Evidence review planned for later in 2019","Amber",9,"Helping young people to be tobacco free","yp_smokefree","M","I",,,"mediumterm",,,"mediumterm  ","individual",,,"individual  "
69,"Local Maternity System knowledgebase","Information on effects of smoking/smoking cessation services/smoke free homes included on LMS knowledgebase.","Increase in visits/hits to knowledgebase per year.","Local Maternity System","Progress unknown","Progress unknown",10,"Maintain and promote smoke free enviornments","smokefree_environments","S/M/L","I",,"shortterm","mediumterm","longterm","ongoing","shortterm mediumterm longterm ongoing","individual",,,"individual  "
70,"Nicotine Replacement Therapy available during hospital stay","Nicotine Replacement Therapy (NRT) to be available to all pregnant women during hospital stay","An increase in the number of pregnant women on NRT during their hospital stay","Maternity at Western Hospitals","Progress unknown","Progress unknown",10,"Maintain and promote smoke free enviornments","smokefree_environments","S","I",,"shortterm",,,,"shortterm   ","individual",,,"individual  "
71,"Review workplace smokefree policies for local authorities","Review the smokefree policy for local authorities","Evidence based workplace policy in WSCC","Public Health, District & Boroughs","Crawley added vaping to workplace policy.","Amber",10,"Maintain and promote smoke free enviornments","smokefree_environments","M","C",,,"mediumterm",,,"mediumterm  ",,"community",,"community "
72,"Health4Families Smokfree policy","Develop a Smokfree policy for all service buildings and areas staff can use whilst at work","All Children and family centres adhere to smokefree policy","Health4Families","Progress unknown","Progress unknown",10,"Maintain and promote smoke free enviornments","smokefree_environments","S","P","Q. is there a policy already in place, what specifically is the action/objective here?","shortterm",,,,"shortterm   ",,,"place","place"
73,"Promoting smokefree environments outside maternity units","Training staff to maintain and promote smokefree environments outside maternity unit","Smoke Free maternity grounds","Maternity at Western Hospitals","Progress unknown","Progress unknown",10,"Maintain and promote smoke free enviornments","smokefree_environments","M","P",,,"mediumterm",,,"mediumterm  ",,,"place","place"
74,"Planning and licensing processes promoting smokefree environments","Explore how planning and licensing processes in local authorities can be utilised to promote  smokefree environments","Smoke Free environments promoted","Public Health, District & Boroughs","Raised at Health and Wellbeing Board, planning element separate.","Progress unknown",10,"Maintain and promote smoke free enviornments","smokefree_environments","M","P",,,"mediumterm",,,"mediumterm  ",,,"place","place"
