"ap_number","ap_title","ap_text","success","partners","progress","achieved","hic_number","hic_label","hic_class","timeframe","level","Clarity required","timeframe_short","timeframe_medium","timeframe_long","ongoing","timeframe_js","level_individual","level_community","level_place","level_js"
1,"Integrated stop smoking services across the Local Maternity System","Integrated stop smoking services across the Sussex and East Surrey Local Maternity System","Maternity partners across the Sussex and East Surrey Local Maternity System work together to enhance integrated stop smoking support for mothers and families.","Local Maternity System","SES LMS Maternal Smoking meeting in July communicated effective models and maternal data systems to inform materniy smoking support and commissioning.  Exploring how integrated maternity opt-out model can be developed in West Sussex","Amber",1,"Working in partnership is the building block for success","working_partnership","M","I",,,"mediumterm",,,"mediumterm  ","individual",,,"individual  "
2,"Pilot project 'Actively Quitting' using physical activity as a diversion","Pilot project 'Actively Quitting' using physical activity as a diversion","Smokers will be referred from SSS to leisure provision","Wellbeing programme","Failed to recruit but hoping to utilise stop smoking service to recruit if possible","Red",1,"Working in partnership is the building block for success","working_partnership","S","I",,"shortterm",,,,"shortterm   ","individual",,,"individual  "
3,"Promote e-cigarettes as a safer and healthier alternative to smoking","Promote e-cigarettes as a safer and healthier alternative to smoking. Work with Public Health 'approved' Vape Shops to give vouchers to bed bound clients","Increase in number of bed bound smokers using E-cigs instead of cigarettes","Fire Service","Specialist home visiting staff always promote e-cigarettes as a safer alternative. The partnership work with Vape Shops forms part of the longer term aspirations as part of a three year plan. We are currently in year 1.","Green",1,"Working in partnership is the building block for success","working_partnership","L","I",,,,"longterm",,"longterm ","individual",,,"individual  "
4,"Greater sharing of intelligence to Trading Standards","Greater sharing of intelligence to Trading Standards","Increase of intel reports to Trading Standards","Trading Standards","There has been a 1% increase in intel reports","Green",2,"Gather and use the full range of data to inform tobacco control","gather_data","S","C/P",,"shortterm",,,,"shortterm   ",,"community","place","community place"
5,"Enhanced maternity dataset","Enhanced maternity dataset ensuring smoking status recorded for all pregnant women","All hospitals within the local LMS footprint collect and report data.","Local Maternity System","Prevention and data recommendations provided to SES LMS Dashboard to support development and improvement of prevention information within maternity dataset. Maternity services adapting to 2019 update to Better Births  maternal stop smoking procedure and data collection .All maternity services are capturing booking data but either failing NHS digital data quality or not submitting data for SATOD. This is largely an issue with mandatory fields within MIS and also training needs to raise profile of importance of discussing maternal smoking and accurate data reporting.","Amber",2,"Gather and use the full range of data to inform tobacco control","gather_data","L","I",,,,"longterm",,"longterm ","individual",,,"individual  "
6,"Improve data capturing from stop smoking services","Improve data capturing from stop smoking services","Improved data quality to understand service delivery and  targeting","Public Health","There is a new data monitoring form for GP practices and new pharmoutcomes template for pharmacies. More rigourous processes are also in place for monitoring data returns and incomplete data are being returned to be resubmitted.","Green",2,"Gather and use the full range of data to inform tobacco control","gather_data","S","I",,"shortterm",,,,"shortterm   ","individual",,,"individual  "
7,"Produce smoking cessation gap analysis and action plan","Produce smoking cessation gap analysis and action plan, based on NICE guidance (PH26) and CLeaR Assessment","Maternity systems demonstrate enhanced stop smoking support and pathways in line with NICE guidance and CLeaR Assessments","Local Maternity System","CLeaR Assessment completed 2018 WaSH catchment. All maternity services are now NICE compliant since Dec 2018 for CO testing. Maternity mandated training update provided to LMS. Prevntion group in June 2018.  Maternity leads Identifying/delivering actions to develop integrated maternal smoking support through training","Green",2,"Gather and use the full range of data to inform tobacco control","gather_data","M","C",,,"mediumterm",,,"mediumterm  ",,"community",,"community "
8,"Report the number of people signposted","Report on the number of people signposted to stop smoking services from wellbeing hubs","Awareness of local smoking population data collected and shared","Wellbeing programme","Smoking status recorded on database referred to community providers-  Stop smoking service soon to be in house.","Green",2,"Gather and use the full range of data to inform tobacco control","gather_data","S/M","C",,"shortterm","mediumterm",,,"shortterm mediumterm  ",,"community",,"community "
9,"Share data gathered from health MOTs","Share data gathered from health MOTs to show the number of people identified as smokers","Awareness of local smoking population data collected and shared","Wellbeing programme","Smoking status recorded on database referred to community providers-  Stop smoking service soon to be in house.","Green",2,"Gather and use the full range of data to inform tobacco control","gather_data","S","C",,"shortterm",,,,"shortterm   ",,"community",,"community "
10,"Smoking status recorded for all pregnant women","Smoking status of all pregnant women captured at time of booking and delivery (mandatory)","Accurate data recorded and shared","Maternity at Western Hospitals","Progress unknown","Progress unknown",2,"Gather and use the full range of data to inform tobacco control","gather_data","S","I",,"shortterm",,,,"shortterm   ","individual",,,"individual  "
11,"Quantify tobacco use by district, age ranges, and ethnicty","Quantify tobacco use by district, age ranges, and ethnicty","Health4Families will be able to target groups to allow appropriate health messages","Health4Families","Progress unknown","Progress unknown",2,"Gather and use the full range of data to inform tobacco control","gather_data","M","C","Q. Is this data you gather that can be shared with others? If so the action needs to change to read share.",,"mediumterm",,,"mediumterm  ",,"community",,"community "
12,"Refresh the Health Equity Audit for stop smoking services","Refresh the West Sussex Health Equit Audit for stop smoking services","Completed HEA used to inform service redseign","Public Health","This is due to start in 2020","Progress unknown",3,"Use tobacco control to tackle health inequalities","health_inequalities","M","c",,,"mediumterm",,,"mediumterm  ",,"community",,"community "
13,"Increase understanding of attitudes to smoking among Eastern Europeans","Increase local understanding of attitudes towards smoking among Eastern Europeans in West Sussex","Approriate interventions developed based on insight","Public Health","This is due to start in 2020","Progress unknown",3,"Use tobacco control to tackle health inequalities","health_inequalities","M","C",,,"mediumterm",,,"mediumterm  ",,"community",,"community "
14,"Support with smokefree prisons","Support  Ministry of Justice and Public Health England with smokefree prisons","Improved pathway for those being released from prison to support their smoking cessation","Public Health","This is due to start in 2020","Progress unknown",3,"Use tobacco control to tackle health inequalities","health_inequalities","L","C",,,,"longterm",,"longterm ",,"community",,"community "
15,"Health4Families targetting tobacco related activity","Target Health4Families tobacco related activity at young parents in areas of deprivation","Increase of young parents/people from deprived wards engaging with SSS","Health4Families","Progress unknown","Progress unknown",3,"Use tobacco control to tackle health inequalities","health_inequalities","M","C",,,"mediumterm",,,"mediumterm  ",,"community",,"community "
16,"Offer targetted workplace health (WPH) services","Target businesses in deprived areas to offer workplace health (WPH) services","Increase in the number of smokers accessing SSS from workplaces deprived areas","Wellbeing programme","Been to smaller businesses such as Worthing, garages, Dome","Green",3,"Use tobacco control to tackle health inequalities","health_inequalities","S/M","C",,"shortterm","mediumterm",,,"shortterm mediumterm  ",,"community",,"community "
17,"Improving links between prisons and community stop smoking services","Build on national smokefree prisons programme by improving links with the community stop smoking services","A pathway to support those being released from prison estate to continue their stop smoking attempt","Prisons","This has not started yet","Red",3,"Use tobacco control to tackle health inequalities","health_inequalities","M","C",,,"mediumterm",,,"mediumterm  ",,"community",,"community "
18,"Use 'Actively Quitting' pilot to target disadvantaged wards","Use 'Actively Quitting' pilot to target disadvantaged wards","Smokers from disadvantaged wards will be referred from SSS to leisure provision","Wellbeing programme","One element done. Going to Mosque in Broadfield","Amber",3,"Use tobacco control to tackle health inequalities","health_inequalities","S","C",,"shortterm",,,,"shortterm   ",,"community",,"community "
19,"Uptake of stop smoking services among substance misuse service users","Work with substance misuse services to improve uptake of stop smoking services by service users","Improved pathway for those accesing substance misuse services to support their smoking cessation","Public Health","This is due to start in 2020","Progress unknown",3,"Use tobacco control to tackle health inequalities","health_inequalities","M","I",,,"mediumterm",,,"mediumterm  ","individual",,,"individual  "
20,"Hold stop smoking surgeries in targetted community locations","Hold stop smoking surgeries in community locations, specifically in disadvantaged wards","Increase in the number of smokers accessing stop smoking services from deprived areas","Wellbeing programme, Primary Care. IPEH Hubs, Voluntary Sectore Organisations, District & Boroughs, Public Health","Focus on  districts where prevalence is higher or number of prvoders lower. In addition to Wellbeing Hub providers being established in these areas, four additional community providers have also been established since the start of the year.","Green",3,"Use tobacco control to tackle health inequalities","health_inequalities","S/M/L","I",,"shortterm","mediumterm","longterm","ongoing","shortterm mediumterm longterm ongoing","individual",,,"individual  "
21,"Actively participate in national and local tobacco control campaigns","Actively participate in national and local tobacco control campaigns","Evaluation of campaign reach which increases year on year. Stoptober campaign promoted in Children and Family Centres and Find it out YP Service.
Evaluation of campaign assessed by service user feedback.
Families signed up for Family Assist receive timed Stoptober information.
Lullaby Trust Safer Sleep Campaign is promoted by the Children’s Workforce in March. Smoking cessation is part of this campaign.","Wellbeing programme, Health4Families, Trading Standards, District & Boroughs, Public Health","Comms plan ongoing. Partners to add suggestions. WSCC communities working on a strategy to work alongside Public Health and D&B Councils.","Green",4,"Deliver Consistent, coherent and coordinated communication","deliver_cccc","S/M","C",,"shortterm","mediumterm",,,"shortterm mediumterm  ",,"community",,"community "
22,"Annual campaign community event","Actively participate in national and local tobacco control campaigns through at least one annual campaign community event organised by 10 fire stations and through social media","Evaluation of campaign reach, which increases year on year","Fire Service","No Smoking Day in March is scheduled for annual campaign activity.","Green",4,"Deliver Consistent, coherent and coordinated communication","deliver_cccc","S/M","C",,"shortterm","mediumterm",,,"shortterm mediumterm  ",,"community",,"community "
23,"Identify approaches that best serve different communities","Identify approaches to disemminating smokefree messages that best serve different communities","Engagement with  BAME groups , particularly Eastern European to gain insight into attitudes towards tobacco use","Communities","Tried approaching ACCORD To support with this but they are unable to. Need to rethink approach","RED",4,"Deliver Consistent, coherent and coordinated communication","deliver_cccc","M","C",,,"mediumterm",,,"mediumterm  ",,"community",,"community "
24,"Lead on tobacco control communication and campaigns","Lead on tobacco control communication and campaigns","A communication plan for the period of this strategy is produced","Public Health","Draft comms plan ready.","Green",4,"Deliver Consistent, coherent and coordinated communication","deliver_cccc","S","P",,"shortterm",,,,"shortterm   ",,,"place","place"
25,"Provide evidence based information via Family Assist","Provision of evidence based and consistent information, including on smoking cessation, to all families across West Sussex, via an easily accessed and interactive digital platform (Family Assist)","Family Assist achieves high levels of engagement with mothers and families in the provision of comprehensive pre-conception guidance, including on stop smoking information","Western Sussex Hospitals NHS Foundation Trust, Sussex Community NHS Foundation Trust, West Sussex County Council","Family Assist has always and continues to provide information on smoking and smoke free homes as routine to all registered users so in reality, The only future changes that will be made to this is the improvement of that information and resource material.","Green",4,"Deliver Consistent, coherent and coordinated communication","deliver_cccc","S","C",,"shortterm",,,,"shortterm   ",,"community",,"community "
26,"Distribute 5,000 Safe and Well information booklets","Distribute 5,000 Safe and Well information booklets to residents receiving a Safe and Well visit. Booklets include information on smoking related fires, how to make a home smoke free and where to go for smoking cessation support.","5,000 booklets will be disctributed to vulnerable people in their homes","Fire Service","The new Safe and Well information booklet was expected to be released in April, unfortunately it was held up due to copyright issues.  It started to be issued to residents by the specialist home visiting staff at the beginning of July.  It will be issued by crews in August once training in its use has been delivered. Distribution figures will be available one month in arrears.","Amber",4,"Deliver Consistent, coherent and coordinated communication","deliver_cccc","S","I",,"shortterm",,,,"shortterm   ","individual",,,"individual  "
27,"Wellbeing programme that supports tobacco control","Develop the role of the wellbeing programme to support tobacco control","West Sussex wellbeing programmes are more engaged in tobacco control","Public Health","Welbeing staff are trained to deliver SSS.","Green",5,"An integrated stop smoking approach","integrated_approach","S","C",,"shortterm",,,,"shortterm   ",,"community",,"community "
28,"Redesign stop smoking service provision in West Sussex","Redesign stop smoking service provision in West Sussex","Effective stop smoking services reaching those that most need to access them","Public Health","Redesign in progress for new service from april 2020.","Green",5,"An integrated stop smoking approach","integrated_approach","L","I",,,,"longterm",,"longterm ","individual",,,"individual  "
29,"Work with Vape shops to support stop smoking providers in primary care","Work with Vape shops to support stop smoking providers","Improved quit rates. Increased comfidence in stop smoking providers to discuss vaping as a mtehod to quit tobacco","Public Health","Specification for working with vape shops agreed to start on coastal strip. Face to face and online training include ecigs advice also fact sheets on wellbeing website.","Green",5,"An integrated stop smoking approach","integrated_approach","S","I",,"shortterm",,,,"shortterm   ","individual",,,"individual  "
30,"Patients are asked about their use of tobacco at pre-assessment clinics","All patients attending pre assessment clinic are asked about their use of tobacco. Smokers are given brief advice and signposted to local stop smoking services","Increase  in number of elective patients being signposted to stop smoking services","Western Sussex Hospitals NHS Foundation Trust","Currently 85%, we anticipate compliance will improve when whole pre-assessment process is recorded  electronically – go live is early August.","Amber",5,"An integrated stop smoking approach","integrated_approach","S","C",,"shortterm",,,,"shortterm   ",,"community",,"community "
31,"Develop a Patient Group Directive around Champix prescribing","Develop a Patient Group Directive around Champix prescribing","Improved quit rates in pharmacy providers","Public Health, Primary Care","Unable to develop appropriate governance route at present","Red",5,"An integrated stop smoking approach","integrated_approach","S","I",,"shortterm",,,,"shortterm   ","individual",,,"individual  "
32,"Improve quality of stop smoking service delivery","Improve quality of stop smoking service delivery","Improved conversion rates","Public Health, Primary Care","Priority scoring tool used to identify providers who may require additional support to improve service quality. Recorded site visits based on this and reduction in scoring proof additional support/training has been effective. Of 17 providers visited last quarter 15 have reduced scoring post visit.","Green",5,"An integrated stop smoking approach","integrated_approach","S","I",,"shortterm",,,,"shortterm   ","individual",,,"individual  "
33,"Improved training offer for stop smoking services","Improve training offer for providers of stop smoking services","Face to face training for new advisors in place and be spoke elearning package for top up training","Public Health, Primary Care","Two training sessions have taken place, with 28 attendees in total. Training sessions for the remainder of the year have been organised and are now live on the Learning and Development Gateway for bookings.","Green",5,"An integrated stop smoking approach","integrated_approach","S","I",,"shortterm",,,,"shortterm   ","individual",,,"individual  "
34,"Referral and follow up to stop smoking services","Referral and follow up to stop smoking services whether the stop smoking intervention is inhouse or external","Drop in number of pregnant women still smoking at time of delivery compared to booking","Maternity at Western Hospitals","Progress unknown","Progress unknown",5,"An integrated stop smoking approach","integrated_approach","S","I",,"shortterm",,,,"shortterm   ","individual",,,"individual  "
36,"Test an integrated midwifery-led stop smoking service","Test an integrated tier 2 midwifery led stop smoking support service","Increase in maternal quit rates between booking and delivery. Shared and integrated learning across Sussex and East Surrey Local Maternity Systems","Local Maternity System","Integrated midwifery-led stop smoking service business case presented to LMS group.  Reviewing feedback.","Green",5,"An integrated stop smoking approach","integrated_approach","L","I",,,,"longterm",,"longterm ","individual",,,"individual  "
37,"Preventing ill health from alcohol and tobacco CQUIN","Support NHS achieve the preventing ill health from alcohol and tobacco CQUIN","Local NHS Trusts have achieved the CQUIN","Public Health","Engaged with WSHT to progress CQUIN","Amber",5,"An integrated stop smoking approach","integrated_approach","M","C",,,"mediumterm",,,"mediumterm  ",,"community",,"community "
38,"Training for primary care staff to deliver stop smoking services","Provide training for primary care staff to deliver stop smoking services","Primary care staff are able to deliver stop smoking services","Public Health, Primary Care","Record training attendance, new and exsisting: 9 trained on 22nd March,  18 trained in June. Next training session on 23rd July","Amber",5,"An integrated stop smoking approach","integrated_approach","S/M/L","I",,"shortterm","mediumterm","longterm","ongoing","shortterm mediumterm longterm ongoing","individual",,,"individual  "
39,"Work with primary care service providers to improve services delivered","Work with primary care service providers to improve quantity and quality of services delivered","More stop smoking services within primary care","Public Health, Primary Care","Improved training provision with F2F training, as well as development of additional online training support (onclick). This allows trained providers to refresh knowledge when required. Provider forums also gives good basis for providers to network and keep up to date with industry trends and developments.","Green",5,"An integrated stop smoking approach","integrated_approach","S/M/L","I",,"shortterm","mediumterm","longterm","ongoing","shortterm mediumterm longterm ongoing","individual",,,"individual  "
40,"Home visiting staff trained in Make Every Contact Count (MECC)","Train Prevention Team home visiting staff in Make Every Contact Count (MECC)","Staff will be more confident in having signposting conversations about smoking cessation and making a record","Fire Service","Specialist home visiting staff have already completed on-line Make Every Contact Count training. Face to Face training will be scheduled for Q3&4 this year.","Amber",6,"Build and sustain capacity in tobacco control","build_sustain_capacity","S","I",,"shortterm",,,,"shortterm   ","individual",,,"individual  "
41,"Rollout Make Every Contact Count (MECC) to 30% of operational crews","Work with the Fire and Rescue Training and Development team to roll out Make Every Contact Count (MECC) to 30% of operational crews","30% of operational personnel will be more confident in having signposting conversations about smoking cessation and recording","Fire Service","The FRS is about to recruit two additional trainer posts who will be expected to work with Public Health to develop and deliver this training to be rolled out commencing next year.","Amber",6,"Build and sustain capacity in tobacco control","build_sustain_capacity","M","I",,,"mediumterm",,,"mediumterm  ","individual",,,"individual  "
42,"A Local Maternity System (LMS) wide action plan","A Local Maternity System (LMS) wide action plan will be developed","Plan developed for use by all organisations which are part of the local LMS.","Local Maternity System","Action plan developed. Includes: 1) Continue to raise importance of data quality
2) Continue to review and respond to training position
3) Review feedback and explore fundiung for integrated midwifery stop smoking service","Green",6,"Build and sustain capacity in tobacco control","build_sustain_capacity","S","C",,"shortterm",,,,"shortterm   ",,"community",,"community "
43,"Carbon monoxide (CO) testing at antenatal appointments","Carbon monoxide (CO) testing at antenatal appointments for all pregnant women","All Pregnant women attending antenatal appointments will be CO tested","Maternity at Western Hospitals","Progress unknown","Progress unknown",6,"Build and sustain capacity in tobacco control","build_sustain_capacity","S","I",,"shortterm",,,,"shortterm   ","individual",,,"individual  "
44,"Training delivered to all HCP staff involved in the care of pregnant women","Ensure training is delivered to all HCP staff involved in the care of pregnant women in the identification of smoking, delivery of smoking cessation advice and referring to smoking cessation services","Each organisation has training developed and available to relevant workforce.","Local Maternity System","Progress unknown","Progress unknown",6,"Build and sustain capacity in tobacco control","build_sustain_capacity","M","C",,,"mediumterm",,,"mediumterm  ",,"community",,"community "
45,"Explore how Dentists could support tobacco control","Explore how Dentists could support tobacco control","Understand the views of dentists to support tobacco control","Public Health","This is due to start in 2020","Progress unknown",6,"Build and sustain capacity in tobacco control","build_sustain_capacity","L","I",,,,"longterm",,"longterm ","individual",,,"individual  "
46,"Delivery of smoking brief advice to non-elective inpatients","Improve the delivery of smoking brief advice to non elective inpatients","Non elective inpatients receive appropriate advice and support to stop smoking","Western Sussex Hospitals NHS Foundation Trust","Smoking very brief advice is currently not recorded. So unable to provide baseline data until recording is mandatory on Patientrack – now planned for late September.","Amber",6,"Build and sustain capacity in tobacco control","build_sustain_capacity","M","I",,,"mediumterm",,,"mediumterm  ","individual",,,"individual  "
